<?xml version='1.0' encoding='ISO-8859-1'?>
<!DOCTYPE videoteca SYSTEM "videoteca.dtd">

<videoteca>
    <pelicula agno = "1997" duracion ="121">
        <titulo>Star Wars</titulo>
        <sinopsis>
            a
        </sinopsis>
        <genero>Aventura</genero>
        <enlace>https://www.imdb.com/title/tt0076759/</enlace>
        <reparto>
            <actor>
                <nombre>dddddddddddd</nombre>
            </actor>
            <actor>
                <nombre>dddddddddddd</nombre>
            </actor>
        </reparto>
    </pelicula>
    <pelicula agno = "1997" duracion ="121">
        <titulo>Star Wars</titulo>
        <sinopsis>
            a
        </sinopsis>
        <genero>Terror</genero>
        <enlace>https://www.imdb.com/title/tt0076759/</enlace>
        <reparto>
            <actor>
                <nombre>dddddddddddd</nombre>
            </actor>
            <actor>
                <nombre>dddddddddddd</nombre>
            </actor>
        </reparto>
    </pelicula>
</videoteca>